,session_id,user_input,chatbot_output,response_time_sec,reference_page,context_pdf,pdf_pages,user_feedback,created_at,updated_at
3,2945694660,why is the sky blue?,"<think>
Okay, let's start by understanding the user's query. They provided a study context about HER-2/neu gene amplification in breast cancer and then asked ""Why is the sky blue?"" That seems odd at first glance because these two topics are unrelated.

First, I need to check if there's any connection between the study mentioned and the question about the sky color. The references talk about oncogenes, receptors, statistical tests like chi-square, and other scientific aspects related to breast cancer research. There's no mention of atmospheric science or light scattering in this context. So, the answer should be straightforward—there's no link.

Now, considering the user might be a Novice familiar with the study. They probably read the provided text but didn't notice the unrelated question. Maybe they're testing if I can distinguish between relevant and irrelevant questions based on the given context. Or perhaps there was a typo or misdirection in their query.

The sky blue phenomenon is explained by Rayleigh scattering, where shorter wavelengths of light (blue) scatter more than longer ones (red). The study's focus isn't on this, so responding with ""I don't know"" makes sense unless the user intended to ask something else related to the study. But given the context provided, there's no connection.

The user might be confused or trying to see if I can handle tangential questions. Alternatively, they could have made a mistake in copying the question. Their deeper need is likely accurate information on their actual query, which here seems misplaced. They probably want an answer about the study but phrased it incorrectly by including the sky blue question.

I should respond clearly that there's no relation between the two topics and explain why I can't answer based on the provided context. This approach addresses both the surface question and the possible underlying need for clarification.
</think>
I don't know",11.44895,7,SlamonetalSCIENCE1987.pdf,8,,2025-06-10 00:30:16.946532,
4,2945694660,what is HER-2/neu,"<think>
Hmm, the user wants me to explain what HER-2/neu is for someone with a Novice level of familiarity. They've provided some scientific text from a study about breast cancer and gene amplification.

Looking at this context, I can see that it's discussing a research study on breast cancers where they evaluated DNA changes in the HER-2/neu gene across 103 tumors. The text mentions using radioactive probes to detect amplification of this gene - specifically showing that 18% of samples had evidence of HER-2/neu gene amplification.

The user is asking about HER-2/neu, which appears to be a key focus in their study. From the context, I can see it's being studied as part of breast cancer research at the University of Texas San Antonio. The text explains they used Southern blot analysis with radioactive probes to detect this gene amplification.

I should explain that HER-2/neu is a specific type of receptor protein found on some breast cells and other tissues. It's important because when it's amplified (meaning there are multiple copies in cancer cells), it can drive tumor growth more aggressively than normal. This makes HER-2 status particularly relevant for determining appropriate treatment options.

I'll keep my explanation simple but informative, focusing on what the gene does normally, how amplification changes its behavior, and why this matters clinically - especially since they're asking about something related to breast cancer research.
</think>
Okay, let's break down that question based on the provided study context:

**What is HER-2/neu?**

In simple terms, **HER-2/neu refers to a specific type of receptor protein found on some cells.**

Here's what it means in this study context:
1.  It's located on the surface of certain breast cells (and other tissues like stomach).
2.  The HER-2 gene provides instructions for making this receptor.
3.  In normal, healthy cells, this receptor helps control cell growth and division.
4.  However, in some aggressive forms of **breast cancer**, the *HER-2* gene is often found to be **amplified** (meaning there are many copies of it). This leads to too much production of the HER-2 protein on the surface of tumor cells.

The study specifically looked for this amplification using DNA tests and radioactive probes. Finding that a breast cancer has amplified *HER-2* genes is important because:
*   It indicates a more aggressive type of breast cancer.
*   This information helps doctors decide if certain targeted treatments (like Herceptin) might be effective.

So, the study was examining how many copies of this specific gene were present in tumor samples and linking that to their potential aggressiveness.",18.639963,6,SlamonetalSCIENCE1987.pdf,8,,2025-06-10 00:40:51.758936,
5,2945694660,"In the initial survey, tissue from how many breast cancers was evaluated for alterations in the HER-2/neu gene?","<think>
Okay, let's tackle this query step by step. The user is asking about the number of breast cancer tissues evaluated in the initial survey for HER-2/neu gene alterations.

First, I need to locate the relevant information in the provided study context. Scanning through the text, there are mentions of ""cases"" and sample sizes. Specifically, looking at the part where they discuss HER-2/neu amplification versus EGFR, it says ""all filters were analyzed with the HER-2/ neu probe (Fig. 3)."" Then in the next paragraph, they mention analyzing all filters for EGFR as well.

The key sentence here is: ""Amplification of the HER-2/neu gene was found in 53/189 cases."" The number 189 appears right after stating that amplification was found in 53 out of these cases. So, the total number of breast cancer tissues evaluated would be 189.

I should also consider if there's any other part of the study mentioning a different sample size for HER-2/neu alone. The text says they used ""the x² test"" on various disease parameters and combined groups (5 to 20 cases and over 20). But when specifically asking about HER-2/neu, it refers back to the same 189 samples mentioned in the EGFR analysis.

Therefore, confirming that all filters analyzed for EGFR were also used for HER-2/neu. The initial survey here is part of a larger study with 189 cases. So the answer should be 189.
</think>
In the initial survey described in the text, tissue from **189** breast cancers was evaluated for alterations in the HER-2/neu gene (as indicated by amplification and rearrangement).",14.046112,6,SlamonetalSCIENCE1987.pdf,8,,2025-06-10 00:47:28.563297,
